id,title,abstract,keywords,year,domain,region,method,theme
ENG_0006,Translation as translation and culture: A Study of Regional Literature in English,"The present research analyses the representation of translation and culture in contemporary Indian writing in English, with particular focus on magical realism published between 2000 and 2024. Using narratology as the theoretical lens, the study explores how selected texts negotiate questions of identity, belonging, and resistance. The research highlights the intersection of translation and culture with caste, gender, and language politics in the Indian literary landscape.","magical realism, postcolonial literature, cultural hybridity, literary studies, Jhumpa Lahiri, narratology",2000,Postcolonial Studies,tribal communities,textual analysis,translation and culture
GEN_0029,Critical Analysis of biodiversity conservation in Post-Independence Tamil Nadu,"The present research examines the relationship between biodiversity conservation and the lived experiences of rural youth in Tamil Nadu. Adopting a narrative inquiry approach within the Commerce framework, the study collected data from 401 participants. Results indicate that biodiversity conservation is deeply embedded in local cultural and institutional structures. Policy recommendations are provided for government and civil society stakeholders.","empirical study, India, Tamil Nadu, biodiversity conservation, Statistics, Commerce",2011,Commerce,Tamil Nadu,narrative inquiry,biodiversity conservation
GEN_0038,A Study on educational access among postgraduate students in Madhya Pradesh,"The present research examines the relationship between educational access and the lived experiences of postgraduate students in Madhya Pradesh. Adopting a ethnographic fieldwork approach within the Zoology framework, the study collected data from 273 participants. Results indicate that educational access is deeply embedded in local cultural and institutional structures. Policy recommendations are provided for government and civil society stakeholders.","cultural identity preservation, empirical study, postgraduate students, Zoology, Statistics, Madhya Pradesh",2020,Zoology,Madhya Pradesh,ethnographic fieldwork,educational access
ENGG_0001,Hybrid machine learning classification for Enhanced explainable AI Performance,This work investigates explainable AI using machine learning classification with application to financial fraud detection. A comprehensive dataset of 8437 samples was collected and preprocessed for training and evaluation. The proposed model integrates advanced Robotics and Automation techniques to improve prediction and classification accuracy. Ablation studies and comparative evaluations confirm the superiority of the proposed approach. This research addresses a critical gap in the literature and provides a deployable solution for Indian industries.,"polymer nanocomposites, financial fraud detection, Robotics and Automation, PhD thesis, engineering research, India",2021,Robotics and Automation,coastal regions,machine learning classification,explainable AI
ENGG_0014,A Machine Learning Framework for low-power IoT devices in drug discovery,This work investigates low-power IoT devices using finite element analysis with application to drug discovery. A comprehensive dataset of 2406 samples was collected and preprocessed for training and evaluation. The proposed model integrates advanced Nanotechnology techniques to improve prediction and classification accuracy. Ablation studies and comparative evaluations confirm the superiority of the proposed approach. This research addresses a critical gap in the literature and provides a deployable solution for Indian industries.,"engineering research, low-power IoT devices, drug discovery, PhD thesis, finite element analysis, cancer detection using machine learning",2022,Nanotechnology,West Bengal,finite element analysis,low-power IoT devices
ENG_0013,narrative identity and cultural materialism in Indian Writing in English,"The present research analyses the representation of narrative identity in contemporary Indian writing in English, with particular focus on partition narrative published between 2000 and 2024. Using cultural materialism as the theoretical lens, the study explores how selected texts negotiate questions of identity, belonging, and resistance. The research highlights the intersection of narrative identity with caste, gender, and language politics in the Indian literary landscape.","cultural materialism, Indian writing in English, narrative identity, Chinua Achebe, postcolonial literature, literary studies",2021,Applied Linguistics,Telangana,textual analysis,narrative identity
GEN_0025,Critical Analysis of agricultural sustainability in Post-Independence Central India,"This paper explores agricultural sustainability as it manifests among migrant workers across Central India. Using systematic literature review, the study draws on data from 391 informants. The analysis situates findings within broader History theory, highlighting structural barriers and enablers. The research contributes original empirical data to an underexplored subfield and proposes a conceptual model for future inquiry.","Central India, migrant workers, migration patterns, empirical study, History, agricultural sustainability",2008,History,Central India,systematic literature review,agricultural sustainability
GEN_0039,Impact of water management on informal sector workers: A Case Study from Kerala,"This paper explores water management as it manifests among informal sector workers across Kerala. Using quasi-experimental study, the study draws on data from 389 informants. The analysis situates findings within broader Zoology theory, highlighting structural barriers and enablers. The research contributes original empirical data to an underexplored subfield and proposes a conceptual model for future inquiry.","Psychology, informal sector workers, water management, Kerala, Zoology, migration patterns",2005,Zoology,Kerala,quasi-experimental study,water management
ENG_0014,A Feminist Analysis of language identity in Kiran Desai's drama,"This study examines language identity in the literary works of Kiran Desai, applying feminist literary criticism as the primary analytical framework. The research investigates how the author constructs language identity through narrative techniques in selected dramas. Drawing on close textual analysis and critical theory, the study reveals how Kiran Desai's writings challenge dominant discourses while articulating subaltern experiences within the Indian socio-cultural context.","Indian writing in English, literary studies, postcolonial literature, exile and alienation, Kiran Desai, drama",2022,Dalit Literature,coastal regions,textual analysis,language identity
ENGG_0013,Blockchain-Based FPGA-based hardware acceleration for Secure 5G wireless networks,"The increasing demand for 5G wireless networks has necessitated efficient solutions for FPGA-based hardware acceleration. This paper proposes a multi-objective optimisation that leverages recent advances in Machine Learning to address this challenge. The proposed architecture is validated through extensive simulations and hardware prototype testing. Results show significant improvements in performance metrics including accuracy, latency, power consumption, and throughput over baseline methods. The work has direct applicability to real-world Indian systems.","India, PhD thesis, Machine Learning, multi-objective optimisation, 5G wireless networks, engineering research",2022,Machine Learning,Bihar,multi-objective optimisation,FPGA-based hardware acceleration
ENG_0019,Voices from the Margin: communicative language teaching in Indian partition narrative Writing,"This research undertakes a postcolonial theory analysis of communicative language teaching in selected works of Indian women writers in English. The study focuses on how these writers use the partition narrative form to articulate experiences of marginalization, resistance, and empowerment. Drawing on feminist scholarship and postcolonial theory, the analysis reveals complex negotiations of gender, caste, and class in contemporary Indian women's writing.","historical fiction, postcolonial literature, partition narrative, communicative language teaching, Derek Walcott, literary studies",2001,Diaspora Literature,VIT Vellore,textual analysis,communicative language teaching
ENGG_0010,A Survey on structural health monitoring: Challenges and Future Directions,"This paper presents a novel computational fluid dynamics simulation for structural health monitoring targeted at drug discovery applications. The proposed system is designed and implemented using state-of-the-art techniques in Data Science. Extensive experiments were conducted on benchmark datasets and real-world scenarios. The results demonstrate that the proposed approach achieves superior performance compared to existing methods, with improvements in accuracy, efficiency, and computational cost. The system has significant potential for deployment in Indian industrial and academic environments.","PhD thesis, India, computational fluid dynamics simulation, anomaly detection, engineering research, drug discovery",2016,Data Science,North-East India,computational fluid dynamics simulation,structural health monitoring
ENGG_0004,FPGA Implementation of medical image segmentation for precision agriculture,This work investigates medical image segmentation using multi-objective optimisation with application to precision agriculture. A comprehensive dataset of 7849 samples was collected and preprocessed for training and evaluation. The proposed model integrates advanced Cybersecurity techniques to improve prediction and classification accuracy. Ablation studies and comparative evaluations confirm the superiority of the proposed approach. This research addresses a critical gap in the literature and provides a deployable solution for Indian industries.,"multi-objective optimisation, precision agriculture, medical image segmentation, Cybersecurity, heat transfer enhancement, engineering research",2021,Cybersecurity,South India,multi-objective optimisation,medical image segmentation
GEN_0034,Patterns of agricultural sustainability among adolescents: A Botany Perspective,"This study investigates agricultural sustainability among adolescents in VIT Vellore using experimental design. The research addresses existing gaps in Botany literature, particularly the lack of region-specific empirical evidence. Primary data was collected from 484 respondents. Findings reveal significant socio-economic disparities influencing agricultural sustainability. The study recommends policy interventions targeting adolescents to improve outcomes.","empirical study, language policy, Botany, India, Statistics, VIT Vellore",2008,Botany,VIT Vellore,experimental design,agricultural sustainability
GEN_0035,Exploring educational access through action research: Evidence from Odisha,"This paper explores educational access as it manifests among postgraduate students across Odisha. Using action research, the study draws on data from 434 informants. The analysis situates findings within broader Linguistics theory, highlighting structural barriers and enablers. The research contributes original empirical data to an underexplored subfield and proposes a conceptual model for future inquiry.","Linguistics, Odisha, Mathematics, educational access, religious pluralism, India",2012,Linguistics,Odisha,action research,educational access
ENGG_0025,Hybrid multi-objective optimisation for Enhanced low-power CMOS design Performance,"The increasing demand for autonomous systems has necessitated efficient solutions for low-power CMOS design. This paper proposes a multi-objective optimisation that leverages recent advances in Robotics and Automation to address this challenge. The proposed architecture is validated through extensive simulations and hardware prototype testing. Results show significant improvements in performance metrics including accuracy, latency, power consumption, and throughput over baseline methods. The work has direct applicability to real-world Indian systems.","transformer models, low-power CMOS design, PhD thesis, engineering research, India, Robotics and Automation",2015,Robotics and Automation,South India,multi-objective optimisation,low-power CMOS design
ENGG_0036,Deep Learning-Based explainable AI for supply chain optimisation: A Comparative Study,This research proposes an efficient ANSYS structural simulation framework for explainable AI in the context of supply chain optimisation. The study addresses key limitations of existing approaches by introducing a Environmental Engineering-based solution that is both scalable and computationally efficient. Experimental evaluation on standard benchmarks confirms the effectiveness of the proposed method. The findings contribute to advancing the state of the art in Environmental Engineering and open new research directions for practical deployment.,"ANSYS structural simulation, federated learning, Environmental Engineering, engineering research, India, PhD thesis",2015,Environmental Engineering,Bihar,ANSYS structural simulation,explainable AI
ENGG_0019,Deep Learning-Based additive manufacturing optimisation for healthcare diagnostics: A Comparative Study,"This paper presents the design, development, and evaluation of a cloud-based system design system for additive manufacturing optimisation. The work is motivated by the growing need for efficient healthcare diagnostics solutions in the Indian context. The proposed approach integrates Aerospace Engineering principles with practical engineering considerations. Performance evaluation using real-world data confirms that the system meets the required specifications. Future work will focus on scaling the solution for large-scale deployment across Indian institutions.","Aerospace Engineering, PhD thesis, India, speech recognition, engineering research, additive manufacturing optimisation",2013,Aerospace Engineering,Uttar Pradesh,cloud-based system design,additive manufacturing optimisation
GEN_0005,Impact of economic empowerment on OBC communities: A Case Study from IIT Madras,"This paper explores economic empowerment as it manifests among OBC communities across IIT Madras. Using content analysis, the study draws on data from 157 informants. The analysis situates findings within broader Linguistics theory, highlighting structural barriers and enablers. The research contributes original empirical data to an underexplored subfield and proposes a conceptual model for future inquiry.","Linguistics, OBC communities, Zoology, empirical study, IIT Madras, India",2013,Linguistics,IIT Madras,content analysis,economic empowerment
GEN_0010,Factors Influencing gender inequality among rural youth in Assam,"This paper explores gender inequality as it manifests among rural youth across Assam. Using narrative inquiry, the study draws on data from 495 informants. The analysis situates findings within broader Education theory, highlighting structural barriers and enablers. The research contributes original empirical data to an underexplored subfield and proposes a conceptual model for future inquiry.","empirical study, climate change adaptation, rural youth, India, gender inequality, Assam",2014,Education,Assam,narrative inquiry,gender inequality
ENGG_0032,Deep Learning-Based DC microgrid control for healthcare diagnostics: A Comparative Study,"The increasing demand for healthcare diagnostics has necessitated efficient solutions for DC microgrid control. This paper proposes a simulation-based study that leverages recent advances in Cybersecurity to address this challenge. The proposed architecture is validated through extensive simulations and hardware prototype testing. Results show significant improvements in performance metrics including accuracy, latency, power consumption, and throughput over baseline methods. The work has direct applicability to real-world Indian systems.","engineering research, DC microgrid control, PhD thesis, healthcare diagnostics, India, wireless sensor networks",2013,Cybersecurity,Telangana,simulation-based study,DC microgrid control
GEN_0015,Impact of migration patterns on self-help group members: A Case Study from NIT Warangal,"This study investigates migration patterns among self-help group members in NIT Warangal using grounded theory. The research addresses existing gaps in Economics literature, particularly the lack of region-specific empirical evidence. Primary data was collected from 289 respondents. Findings reveal significant socio-economic disparities influencing migration patterns. The study recommends policy interventions targeting self-help group members to improve outcomes.","self-help group members, Women Studies, health-seeking behavior, empirical study, Economics, migration patterns",2006,Economics,NIT Warangal,grounded theory,migration patterns
ENGG_0030,Optimisation of FPGA-based hardware acceleration Using Arduino/Raspberry Pi implementation in Nanotechnology,"This paper presents the design, development, and evaluation of a Arduino/Raspberry Pi implementation system for FPGA-based hardware acceleration. The work is motivated by the growing need for efficient defence systems solutions in the Indian context. The proposed approach integrates Nanotechnology principles with practical engineering considerations. Performance evaluation using real-world data confirms that the system meets the required specifications. Future work will focus on scaling the solution for large-scale deployment across Indian institutions.","Nanotechnology, Arduino/Raspberry Pi implementation, defence systems, engineering research, India, PhD thesis",2012,Nanotechnology,Karnataka,Arduino/Raspberry Pi implementation,FPGA-based hardware acceleration
GEN_0032,urbanisation impact and college students: Challenges and Opportunities in Karnataka,"This paper explores urbanisation impact as it manifests among college students across Karnataka. Using experimental design, the study draws on data from 221 informants. The analysis situates findings within broader Environmental Science theory, highlighting structural barriers and enablers. The research contributes original empirical data to an underexplored subfield and proposes a conceptual model for future inquiry.","Environmental Science, college students, urbanisation impact, empirical study, political participation, Anthropology",2007,Environmental Science,Karnataka,experimental design,urbanisation impact
ENGG_0028,Optimisation of medical image segmentation Using multi-objective optimisation in Renewable Energy Engineering,"The increasing demand for remote sensing has necessitated efficient solutions for medical image segmentation. This paper proposes a multi-objective optimisation that leverages recent advances in Renewable Energy Engineering to address this challenge. The proposed architecture is validated through extensive simulations and hardware prototype testing. Results show significant improvements in performance metrics including accuracy, latency, power consumption, and throughput over baseline methods. The work has direct applicability to real-world Indian systems.","India, multi-objective optimisation, PhD thesis, medical image segmentation, Renewable Energy Engineering, structural health monitoring",2010,Renewable Energy Engineering,Kerala,multi-objective optimisation,medical image segmentation
GEN_0022,Impact of mental health awareness on scheduled castes: A Case Study from North-East India,"This paper explores mental health awareness as it manifests among scheduled castes across North-East India. Using narrative inquiry, the study draws on data from 185 informants. The analysis situates findings within broader Zoology theory, highlighting structural barriers and enablers. The research contributes original empirical data to an underexplored subfield and proposes a conceptual model for future inquiry.","India, North-East India, Psychology, scheduled castes, biodiversity conservation, mental health awareness",2008,Zoology,North-East India,narrative inquiry,mental health awareness
GEN_0014,agricultural sustainability and elderly: Challenges and Opportunities in North India,"This paper explores agricultural sustainability as it manifests among elderly across North India. Using experimental design, the study draws on data from 192 informants. The analysis situates findings within broader History theory, highlighting structural barriers and enablers. The research contributes original empirical data to an underexplored subfield and proposes a conceptual model for future inquiry.","Chemistry, elderly, History, empirical study, mental health awareness, agricultural sustainability",2020,History,North India,experimental design,agricultural sustainability
ENGG_0007,Real-Time millimetre wave communication Using finite element analysis: Design and Evaluation,"This paper presents a novel finite element analysis for millimetre wave communication targeted at autonomous systems applications. The proposed system is designed and implemented using state-of-the-art techniques in Electrical Engineering. Extensive experiments were conducted on benchmark datasets and real-world scenarios. The results demonstrate that the proposed approach achieves superior performance compared to existing methods, with improvements in accuracy, efficiency, and computational cost. The system has significant potential for deployment in Indian industrial and academic environments.","engineering research, PhD thesis, millimetre wave communication, finite element analysis, India, Electrical Engineering",2021,Electrical Engineering,Anna University,finite element analysis,millimetre wave communication
ENGG_0034,Energy-Efficient green building energy efficiency for water resource management in Resource-Constrained Environments,This research proposes an efficient multi-objective optimisation framework for green building energy efficiency in the context of water resource management. The study addresses key limitations of existing approaches by introducing a Cybersecurity-based solution that is both scalable and computationally efficient. Experimental evaluation on standard benchmarks confirms the effectiveness of the proposed method. The findings contribute to advancing the state of the art in Cybersecurity and open new research directions for practical deployment.,"wastewater treatment using nanomaterials, PhD thesis, engineering research, multi-objective optimisation, green building energy efficiency, Cybersecurity",2010,Cybersecurity,Rajasthan,multi-objective optimisation,green building energy efficiency
GEN_0024,Factors Influencing gender inequality among urban youth in NIT Warangal,"This study investigates gender inequality among urban youth in NIT Warangal using qualitative case study. The research addresses existing gaps in Linguistics literature, particularly the lack of region-specific empirical evidence. Primary data was collected from 88 respondents. Findings reveal significant socio-economic disparities influencing gender inequality. The study recommends policy interventions targeting urban youth to improve outcomes.","NIT Warangal, Linguistics, urban youth, gender inequality, Chemistry, empirical study",2009,Linguistics,NIT Warangal,qualitative case study,gender inequality
GEN_0003,Role of cultural identity preservation in Shaping the Lives of migrant workers in Punjab,"This study investigates cultural identity preservation among migrant workers in Punjab using participatory rural appraisal. The research addresses existing gaps in Education literature, particularly the lack of region-specific empirical evidence. Primary data was collected from 102 respondents. Findings reveal significant socio-economic disparities influencing cultural identity preservation. The study recommends policy interventions targeting migrant workers to improve outcomes.","India, economic empowerment, cultural identity preservation, Education, empirical study, migrant workers",2007,Education,Punjab,participatory rural appraisal,cultural identity preservation
ENG_0007,postcolonial theory and ESL classroom dynamics: A Study of Selected short storys,"This paper investigates ESL classroom dynamics in the short storys of Meena Alexander, situating the analysis within the framework of postcolonial theory. The study employs textual analysis and comparative methodology to examine how literary representations of ESL classroom dynamics reflect broader socio-political realities in postcolonial India. The research argues that Meena Alexander's literary imagination offers a unique perspective on questions of culture, identity, and power.","historical fiction, Indian writing in English, literary studies, postcolonial theory, short story, postcolonial literature",2012,Dalit Literature,coastal regions,textual analysis,ESL classroom dynamics
ENG_0015,Gender and literature in ELT in the autobiographys of Raja Rao,"This paper investigates literature in ELT in the autobiographys of Raja Rao, situating the analysis within the framework of psychoanalytic criticism. The study employs textual analysis and comparative methodology to examine how literary representations of literature in ELT reflect broader socio-political realities in postcolonial India. The research argues that Raja Rao's literary imagination offers a unique perspective on questions of culture, identity, and power.","Indian writing in English, autobiography, literature in ELT, literary studies, psychoanalytic criticism, reading comprehension strategies",2001,English Language,Punjab,textual analysis,literature in ELT
